[
  {
    "schema_version": "1.0",
    "measurement_id": "demo-m-42-0000",
    "session_id": "demo-session-000",
    "subject_id": "demo-subject-000",
    "device_id": "demo-device-001",
    "eye": "OD",
    "captured_at": "2026-10-04T09:00:00+00:00",
    "synthetic": true,
    "quality_status": "pass",
    "quality_reasons": [],
    "iop_estimate_mmhg": 15.09,
    "calibration_id": "demo-calibration-001",
    "model_id": "demo-no-clinical-model",
    "firmware_version": "demo-0.1.0",
    "raw_sha256": "ee84f056bb13f28f4f860534a6509935f33cacfe7cfc850988a9780a5970e901",
    "clock_status": "trusted"
  },
  {
    "schema_version": "1.0",
    "measurement_id": "demo-m-42-0001",
    "session_id": "demo-session-000",
    "subject_id": "demo-subject-000",
    "device_id": "demo-device-001",
    "eye": "OS",
    "captured_at": "2026-10-04T09:01:00+00:00",
    "synthetic": true,
    "quality_status": "pass",
    "quality_reasons": [],
    "iop_estimate_mmhg": 25.62,
    "calibration_id": "demo-calibration-001",
    "model_id": "demo-no-clinical-model",
    "firmware_version": "demo-0.1.0",
    "raw_sha256": "2114d0d4bb98f1292e4cb42cf00fbb97ce996e7ed8e5df92985aa709287da1c6",
    "clock_status": "trusted"
  },
  {
    "schema_version": "1.0",
    "measurement_id": "demo-m-42-0002",
    "session_id": "demo-session-000",
    "subject_id": "demo-subject-000",
    "device_id": "demo-device-001",
    "eye": "OD",
    "captured_at": "2026-10-04T09:02:00+00:00",
    "synthetic": true,
    "quality_status": "pass",
    "quality_reasons": [],
    "iop_estimate_mmhg": 17.18,
    "calibration_id": "demo-calibration-001",
    "model_id": "demo-no-clinical-model",
    "firmware_version": "demo-0.1.0",
    "raw_sha256": "eba58bdcc7f5cba0119d18ba44dbc5687b80cb35b4d12c35f3e9f870a1b959cf",
    "clock_status": "trusted"
  },
  {
    "schema_version": "1.0",
    "measurement_id": "demo-m-42-0003",
    "session_id": "demo-session-000",
    "subject_id": "demo-subject-000",
    "device_id": "demo-device-001",
    "eye": "OS",
    "captured_at": "2026-10-04T09:03:00+00:00",
    "synthetic": true,
    "quality_status": "pass",
    "quality_reasons": [],
    "iop_estimate_mmhg": 12.45,
    "calibration_id": "demo-calibration-001",
    "model_id": "demo-no-clinical-model",
    "firmware_version": "demo-0.1.0",
    "raw_sha256": "aba6ef84df551f362ab29f37353d5153133837bccd7b04ecf1e8dbdc78032346",
    "clock_status": "trusted"
  },
  {
    "schema_version": "1.0",
    "measurement_id": "demo-m-42-0004",
    "session_id": "demo-session-001",
    "subject_id": "demo-subject-001",
    "device_id": "demo-device-001",
    "eye": "OD",
    "captured_at": "2026-10-04T09:04:00+00:00",
    "synthetic": true,
    "quality_status": "pass",
    "quality_reasons": [],
    "iop_estimate_mmhg": 17.59,
    "calibration_id": "demo-calibration-001",
    "model_id": "demo-no-clinical-model",
    "firmware_version": "demo-0.1.0",
    "raw_sha256": "828d4fbe6fd047cdac86dcd14d1f09caa6890637e22e2e4088be4e34edce364d",
    "clock_status": "trusted"
  },
  {
    "schema_version": "1.0",
    "measurement_id": "demo-m-42-0005",
    "session_id": "demo-session-001",
    "subject_id": "demo-subject-001",
    "device_id": "demo-device-001",
    "eye": "OS",
    "captured_at": "2026-10-04T09:05:00+00:00",
    "synthetic": true,
    "quality_status": "reject",
    "quality_reasons": [
      "blink"
    ],
    "iop_estimate_mmhg": null,
    "calibration_id": "demo-calibration-001",
    "model_id": "demo-no-clinical-model",
    "firmware_version": "demo-0.1.0",
    "raw_sha256": "6e57c107cb5158437165fa0605792cf2a60470f5105c33b4f4e973e382ca75e8",
    "clock_status": "trusted"
  },
  {
    "schema_version": "1.0",
    "measurement_id": "demo-m-42-0006",
    "session_id": "demo-session-001",
    "subject_id": "demo-subject-001",
    "device_id": "demo-device-001",
    "eye": "OD",
    "captured_at": "2026-10-04T09:06:00+00:00",
    "synthetic": true,
    "quality_status": "pass",
    "quality_reasons": [],
    "iop_estimate_mmhg": 20.95,
    "calibration_id": "demo-calibration-001",
    "model_id": "demo-no-clinical-model",
    "firmware_version": "demo-0.1.0",
    "raw_sha256": "5b2cf40cd1d3416f1184abca0ef56a0b1bfe0f7c93190dc1475020e899dc9874",
    "clock_status": "trusted"
  },
  {
    "schema_version": "1.0",
    "measurement_id": "demo-m-42-0007",
    "session_id": "demo-session-001",
    "subject_id": "demo-subject-001",
    "device_id": "demo-device-001",
    "eye": "OS",
    "captured_at": "2026-10-04T09:07:00+00:00",
    "synthetic": true,
    "quality_status": "pass",
    "quality_reasons": [],
    "iop_estimate_mmhg": 13.2,
    "calibration_id": "demo-calibration-001",
    "model_id": "demo-no-clinical-model",
    "firmware_version": "demo-0.1.0",
    "raw_sha256": "8b0e919a0c08550425758005990836aa613e9e5b725a68b9dd19c2531c9db7fb",
    "clock_status": "trusted"
  },
  {
    "schema_version": "1.0",
    "measurement_id": "demo-m-42-0008",
    "session_id": "demo-session-002",
    "subject_id": "demo-subject-002",
    "device_id": "demo-device-001",
    "eye": "OD",
    "captured_at": "2026-10-04T09:08:00+00:00",
    "synthetic": true,
    "quality_status": "pass",
    "quality_reasons": [],
    "iop_estimate_mmhg": 21.1,
    "calibration_id": "demo-calibration-001",
    "model_id": "demo-no-clinical-model",
    "firmware_version": "demo-0.1.0",
    "raw_sha256": "91951dd5bd9243de227b8dd63caf2b82c0ab1ef226dca31c068993ec5252cebc",
    "clock_status": "trusted"
  },
  {
    "schema_version": "1.0",
    "measurement_id": "demo-m-42-0009",
    "session_id": "demo-session-002",
    "subject_id": "demo-subject-002",
    "device_id": "demo-device-001",
    "eye": "OS",
    "captured_at": "2026-10-04T09:09:00+00:00",
    "synthetic": true,
    "quality_status": "pass",
    "quality_reasons": [],
    "iop_estimate_mmhg": 15.0,
    "calibration_id": "demo-calibration-001",
    "model_id": "demo-no-clinical-model",
    "firmware_version": "demo-0.1.0",
    "raw_sha256": "31a929b97f20ebfcbb1dcb089961f3748794c761948b6df74c8e0f5cfb9fce35",
    "clock_status": "trusted"
  },
  {
    "schema_version": "1.0",
    "measurement_id": "demo-m-42-0010",
    "session_id": "demo-session-002",
    "subject_id": "demo-subject-002",
    "device_id": "demo-device-001",
    "eye": "OD",
    "captured_at": "2026-10-04T09:10:00+00:00",
    "synthetic": true,
    "quality_status": "pass",
    "quality_reasons": [],
    "iop_estimate_mmhg": 16.75,
    "calibration_id": "demo-calibration-001",
    "model_id": "demo-no-clinical-model",
    "firmware_version": "demo-0.1.0",
    "raw_sha256": "f7b016643e30a7058b793fd3dc0c66905f192583d3c4a462b33b11c9a513d98b",
    "clock_status": "trusted"
  },
  {
    "schema_version": "1.0",
    "measurement_id": "demo-m-42-0011",
    "session_id": "demo-session-002",
    "subject_id": "demo-subject-002",
    "device_id": "demo-device-001",
    "eye": "OS",
    "captured_at": "2026-10-04T09:11:00+00:00",
    "synthetic": true,
    "quality_status": "reject",
    "quality_reasons": [
      "blink"
    ],
    "iop_estimate_mmhg": null,
    "calibration_id": "demo-calibration-001",
    "model_id": "demo-no-clinical-model",
    "firmware_version": "demo-0.1.0",
    "raw_sha256": "d746e4c7b20f54b98ba2146aaef9b18bd73cc1b797446a294d5325a486b895b8",
    "clock_status": "trusted"
  }
]
